{
  "environmental_context_id": "ENV-E2026-03-10-001",
  "event_id": "E2026-03-10-001",
  "asset_id": "U1-RPS-CORE",
  "generated_at": "2026-03-10T16:00:00Z",
  "window": {
    "start": "2026-03-10T14:00:00Z",
    "end": "2026-03-10T15:00:00Z"
  },
  "records": [
    {
      "record_id": "ENV-CONT-RAD-BACKGROUND",
      "timestamp": "2026-03-10T14:22:03Z",
      "record_type": "ambient_temperature",
      "location": "containment_building",
      "severity": "low",
      "value": null,
      "unit": null,
      "duration_seconds": 3600,
      "description": "Containment radiation monitors at background levels throughout event window. No radioactive material release. Containment intact. Environmental factor: no contribution to event.",
      "source_system": "RADIATION_MONITORING"
    },
    {
      "record_id": "ENV-EMI-CABINET-AREA",
      "timestamp": "2026-03-10T14:22:03Z",
      "record_type": "emi",
      "location": "ni_instrument_cabinet_area_u1",
      "severity": "medium",
      "value": null,
      "unit": null,
      "duration_seconds": null,
      "description": "Electromagnetic interference susceptibility noted in U1 NI channel 4 cabinet area per CR-2025-07843. EMI source identified as unshielded cable in adjacent panel — remediation WO issued but not yet completed. EMI is a known contributor to spurious NI signal excursions on this channel.",
      "source_system": "ELEC_MAINTENANCE_LOG"
    }
  ],
  "quality": {
    "coverage_status": "complete",
    "quality_flags": []
  },
  "provenance": {
    "generated_by": "show-and-tell-fixture-generator",
    "query_params": {"test_case": "TC-4", "scenario": "reactor-trip-ni-spurious"}
  }
}
