{
  "environmental_context_id": "ENV-EVT-U2-2024-0847",
  "event_id": "EVT-U2-2024-0847",
  "asset_id": "U2-CONDENSER-MAIN",
  "generated_at": "2024-07-14T06:00:00Z",
  "window": {
    "start": "2024-06-30T00:00:00Z",
    "end": "2024-07-14T04:00:00Z"
  },
  "records": [
    {
      "record_id": "ENV-CW-INLET-TEMP-SEASONAL",
      "timestamp": "2024-07-14T03:22:00Z",
      "record_type": "ambient_temperature",
      "location": "circulating_water_intake",
      "severity": "low",
      "value": 75.4,
      "unit": "degF",
      "duration_seconds": 1209600,
      "description": "4.2 degF seasonal CW inlet temperature rise over 14-day window (71.2 degF baseline to 75.4 degF observed). Within expected summer range for this site (73 to 78 degF). Operator increased CW pump speed from 85% to 100% on 2024-07-12 \u2014 only 0.04 inHg backpressure reduction observed. CW temperature elevation alone is insufficient to explain the 1.2 inHg backpressure increase. Environmental factor: not causal.",
      "source_system": "PI_HISTORIAN"
    },
    {
      "record_id": "ENV-COND-PIT-AMBIENT-DRIFT",
      "timestamp": "2024-07-04T09:00:00Z",
      "record_type": "ambient_temperature",
      "location": "condenser_pit_turbine_building",
      "severity": "high",
      "value": 97.6,
      "unit": "degF",
      "duration_seconds": 864000,
      "description": "Condenser pit ambient temperature rose from 82.1 degF baseline to 97.6 degF peak (15.5 degF above baseline) over 10 days. Rise onset coincides within 1 hour of HVAC turbine bay fan A trip on high vibration (2024-07-04T09:10). Causal sequence: HVAC fan bearing failure \u2014 reduced turbine bay ventilation \u2014 elevated pit ambient temperature \u2014 accelerated thermal fatigue of condenser expansion joint seal material. 15.5 degF above baseline is abnormal and exceeds seasonal variation by 11 degF. This environmental record directly links HVAC PM deferral to the primary causal chain.",
      "source_system": "PI_HISTORIAN"
    }
  ],
  "quality": {
    "coverage_status": "complete",
    "quality_flags": []
  },
  "provenance": {
    "generated_by": "show-and-tell-fixture-generator",
    "query_params": {
      "test_case": "TC-3",
      "scenario": "condenser-vacuum-loss-pwr-u2"
    }
  }
}